{
  "id": "mission-control",
  "version": "1.4",
  "nav": [
    {
      "id": "mission-control",
      "label": "Dashboard",
      "href": "/dashboard"
    }
  ],
  "family": {
    "selector": "runtime.os",
    "members": [
      {
        "id": "mission-control-linux",
        "when": {
          "os": [
            "linux"
          ]
        }
      }
    ]
  }
}
